{
  "schemaVersion": 1,
  "tool": {
    "name": "testguard",
    "version": "0.3.0"
  },
  "generatedAt": "2026-09-17T15:24:13.654Z",
  "state": "clean",
  "next": {
    "action": "none",
    "command": "testguard probe",
    "why": "Every claim is defended. Re-probe after changing code, tests or claims; add a claim for every new invariant."
  },
  "provisional": false,
  "counts": {
    "claims": 12,
    "faults": 12,
    "byVerdict": {
      "killed": 12
    },
    "new": 0,
    "baselined": 0
  },
  "stale": [],
  "changedFaults": [],
  "findings": [],
  "paths": {
    "claims": "testguard.claims.json",
    "evidence": ".testguard/evidence.json",
    "baseline": ".testguard/baseline.json"
  }
}
